{
  "$schema": "https://json-schema.org/draft/2020-12/schema",
  "$id": "https://github.com/mickeyyaya/v-eval/schema/report/0.1.0",
  "title": "v-eval report",
  "type": "object",
  "additionalProperties": false,
  "required": ["identity", "contract", "routing", "observations", "claims", "criteria", "forensics", "counts", "status", "improvement", "limitations", "provenance"],
  "properties": {
    "identity": {"type": "object", "additionalProperties": false,
      "required": ["report_id", "schema_version", "veval_version", "skill_revision", "artifact", "task", "created_at", "host"],
      "properties": {
        "report_id": {"type": "string", "pattern": "^(sha256:[0-9a-f]{64})?$"},
        "schema_version": {"const": "0.1.0"},
        "veval_version": {"type": "string", "minLength": 1},
        "skill_revision": {"type": "string", "minLength": 1},
        "artifact": {"type": "object", "additionalProperties": false, "required": ["kind", "revision", "paths", "bundle_digest"],
          "properties": {"kind": {"type": "string", "minLength": 1}, "revision": {"type": "string", "minLength": 1}, "paths": {"type": "array", "items": {"type": "string"}}, "bundle_digest": {"type": "string"}}},
        "task": {"type": "object", "additionalProperties": false, "required": ["requested_outcome", "intended_user", "brief_ref"],
          "properties": {"requested_outcome": {"type": "string", "minLength": 1}, "intended_user": {"type": "string"}, "brief_ref": {"type": "string"}}},
        "created_at": {"type": "string", "format": "date-time"},
        "host": {"type": "object", "additionalProperties": false, "required": ["cli", "os", "arch"],
          "properties": {"cli": {"type": "string"}, "model": {"type": "string"}, "os": {"type": "string"}, "arch": {"type": "string"}}}}},
    "contract": {"type": "object", "additionalProperties": false,
      "required": ["contract_id", "contract_version", "status", "conflicts", "criteria"],
      "properties": {
        "contract_id": {"type": "string", "minLength": 1},
        "contract_version": {"type": "string", "minLength": 1},
        "status": {"enum": ["user_specified", "provisional", "approved"]},
        "conflicts": {"type": "array", "items": {"type": "object", "additionalProperties": false, "required": ["between", "description", "resolution"],
          "properties": {"between": {"type": "array", "items": {"type": "string"}}, "description": {"type": "string"}, "resolution": {"type": "string", "minLength": 1}}}},
        "criteria": {"type": "array", "minItems": 1, "items": {"$ref": "#/$defs/criterion"}}}},
    "routing": {"type": "object", "additionalProperties": false,
      "required": ["supplied", "profiles", "adapters_run", "adapters_skipped", "ambiguity", "rationale"],
      "properties": {
        "supplied": {"type": "array", "items": {"type": "object", "additionalProperties": false, "required": ["source_type", "count", "origin"],
          "properties": {"source_type": {"type": "string"}, "count": {"type": "integer", "minimum": 0}, "origin": {"type": "string"}}}},
        "profiles": {"type": "array", "items": {"type": "object", "additionalProperties": false, "required": ["name", "version"], "properties": {"name": {"type": "string"}, "version": {"type": "string"}}}},
        "adapters_run": {"type": "array", "items": {"type": "object", "additionalProperties": false, "required": ["name", "version", "inputs_used"],
          "properties": {"name": {"type": "string"}, "version": {"type": "string"}, "inputs_used": {"type": "array", "items": {"type": "string"}}}}},
        "adapters_skipped": {"type": "array", "items": {"type": "object", "additionalProperties": false, "required": ["name", "missing_input"], "properties": {"name": {"type": "string"}, "missing_input": {"type": "string"}}}},
        "ambiguity": {"type": "array", "items": {"type": "object", "additionalProperties": false, "required": ["question", "resolution"], "properties": {"question": {"type": "string"}, "resolution": {"type": "string"}}}},
        "rationale": {"type": "string", "minLength": 1}}},
    "observations": {"type": "array", "items": {"type": "object", "additionalProperties": false, "required": ["id", "text", "evidence", "criterion_ids", "origin"],
      "properties": {"id": {"type": "string", "minLength": 1}, "text": {"type": "string", "minLength": 1}, "evidence": {"$ref": "#/$defs/evidence_list"}, "criterion_ids": {"type": "array", "items": {"type": "string"}}, "origin": {"enum": ["assistant", "adapter", "detector"]}}}},
    "claims": {"type": "array", "items": {"type": "object", "additionalProperties": false, "required": ["claim_id", "text", "location", "status", "verification", "notes"],
      "properties": {"claim_id": {"type": "string", "minLength": 1}, "text": {"type": "string", "minLength": 1}, "location": {"type": "string"}, "status": {"enum": ["verified", "contradicted", "unverified", "not_checkable"]}, "verification": {"$ref": "#/$defs/evidence_list"}, "notes": {"type": "string"}}}},
    "criteria": {"type": "array", "minItems": 1, "items": {"type": "object", "additionalProperties": false,
      "required": ["id", "result", "method_used", "evidence", "reasoning", "next_action", "shared_cause_with", "dimension_refs"],
      "properties": {"id": {"type": "string", "minLength": 1}, "result": {"$ref": "#/$defs/result"}, "method_used": {"$ref": "#/$defs/method"}, "evidence": {"$ref": "#/$defs/evidence_list"}, "reasoning": {"type": "string"}, "next_action": {"type": "string"}, "shared_cause_with": {"type": "array", "items": {"type": "string"}}, "dimension_refs": {"type": "array", "items": {"type": "string"}}}}},
    "forensics": {"type": "array", "items": {"type": "object", "additionalProperties": false,
      "required": ["finding_id", "detector", "detector_version", "criterion_id", "severity", "evidence", "benign_alternative", "disposition"],
      "properties": {"finding_id": {"type": "string", "minLength": 1}, "detector": {"type": "string"}, "detector_version": {"type": "string"}, "criterion_id": {"type": "string"}, "severity": {"enum": ["observed", "suspicious", "confirmed"]}, "evidence": {"$ref": "#/$defs/evidence_list"}, "benign_alternative": {"type": "string"}, "disposition": {"enum": ["open", "explained", "confirmed"]}}}},
    "dimensions": {"type": "array", "items": {"type": "object", "additionalProperties": false,
      "required": ["dimension", "metric", "metric_version", "authority_type", "definition_ref", "unit", "range", "direction", "value", "threshold", "threshold_source", "tool", "tool_version", "workload", "evidence", "interpretation"],
      "properties": {"dimension": {"type": "string"}, "metric": {"type": "string"}, "metric_version": {"type": "string"}, "authority_type": {"enum": ["formal_standard", "established_measure", "vendor_rating", "project_rubric"]}, "definition_ref": {"type": "string", "minLength": 1}, "unit": {"type": "string"}, "range": {"type": "string"}, "direction": {"type": "string"}, "value": {"type": ["number", "null"]}, "threshold": {"type": "string"}, "threshold_source": {"type": "string"}, "tool": {"type": "string"}, "tool_version": {"type": "string"}, "workload": {"type": "string"}, "evidence": {"$ref": "#/$defs/evidence_list"}, "interpretation": {"type": "string"}}}},
    "counts": {"type": "object", "additionalProperties": false, "required": ["required", "optional", "coverage"],
      "properties": {"required": {"$ref": "#/$defs/tally"}, "optional": {"$ref": "#/$defs/tally"}, "coverage": {"type": "object", "additionalProperties": false, "required": ["numerator", "denominator", "undefined"], "properties": {"numerator": {"type": "integer", "minimum": 0}, "denominator": {"type": "integer", "minimum": 0}, "undefined": {"type": "boolean"}}}}},
    "status": {"type": "object", "additionalProperties": false, "required": ["overall", "rule_applied", "blocked_by", "advisory"],
      "properties": {"overall": {"enum": ["PASS", "FAIL", "INCOMPLETE", "ADVISORY"]}, "rule_applied": {"type": "string", "minLength": 1}, "blocked_by": {"type": "array", "items": {"type": "string"}}, "advisory": {"type": "boolean"}}},
    "improvement": {"type": "array", "items": {"type": "object", "additionalProperties": false, "required": ["issue", "locations", "suggested_change", "constraints_to_preserve", "verify_by", "linked_criteria"],
      "properties": {"issue": {"type": "string"}, "locations": {"type": "array", "items": {"type": "string"}}, "suggested_change": {"type": "string"}, "constraints_to_preserve": {"type": "array", "items": {"type": "string"}}, "verify_by": {"type": "string"}, "linked_criteria": {"type": "array", "items": {"type": "string"}}}}},
    "limitations": {"type": "object", "additionalProperties": false, "required": ["not_inspected", "not_executed", "unknown_metadata", "assumptions"],
      "properties": {"not_inspected": {"type": "array", "items": {"type": "string"}}, "not_executed": {"type": "array", "items": {"type": "string"}}, "unknown_metadata": {"type": "array", "items": {"type": "string"}}, "assumptions": {"type": "array", "items": {"type": "string"}}}},
    "provenance": {"type": "object", "additionalProperties": false, "required": ["tools", "commands", "environment", "isolation_levels_used", "evidence_digest"],
      "properties": {"tools": {"type": "array", "items": {"type": "object", "additionalProperties": false, "required": ["name", "version"], "properties": {"name": {"type": "string"}, "version": {"type": "string"}}}},
                     "commands": {"type": "array", "items": {"type": "object", "additionalProperties": false, "required": ["command", "cwd", "exit_status", "started_at", "ended_at", "log_ref", "isolation"],
                                  "properties": {"command": {"type": "string"}, "cwd": {"type": "string"}, "exit_status": {"type": "integer"}, "started_at": {"type": "string"}, "ended_at": {"type": "string"}, "log_ref": {"type": "string"}, "isolation": {"$ref": "#/$defs/isolation"}}}},
                     "environment": {"type": "object", "additionalProperties": false, "required": ["os", "arch", "runtime_versions"], "properties": {"os": {"type": "string"}, "arch": {"type": "string"}, "runtime_versions": {"type": "object", "additionalProperties": {"type": "string"}}}},
                     "isolation_levels_used": {"type": "array", "items": {"$ref": "#/$defs/isolation"}},
                     "evidence_digest": {"type": "string", "pattern": "^(sha256:[0-9a-f]{64})?$"}}},
    "learning": {"type": "object", "additionalProperties": false, "required": ["precedents_retrieved", "reward_records_created"],
      "properties": {"precedents_retrieved": {"type": "array", "items": {"type": "object", "additionalProperties": false, "required": ["precedent_id", "criterion", "similarity"], "properties": {"precedent_id": {"type": "string"}, "criterion": {"type": "string"}, "similarity": {"type": "number", "minimum": 0, "maximum": 1}}}},
                     "reward_records_created": {"type": "array", "items": {"type": "string"}}}}
  },
  "$defs": {
    "result": {"enum": ["PASS", "FAIL", "UNKNOWN", "ERROR", "NOT_APPLICABLE"]},
    "method": {"enum": ["execution", "deterministic_check", "static_inspection", "source_verification", "rubric_judgment", "human_judgment"]},
    "isolation": {"enum": ["none", "worktree", "container", "remote_sandbox"]},
    "tally": {"type": "object", "additionalProperties": false, "required": ["applicable", "pass", "fail", "unknown", "error", "not_applicable"],
      "properties": {"applicable": {"type": "integer", "minimum": 0}, "pass": {"type": "integer", "minimum": 0}, "fail": {"type": "integer", "minimum": 0}, "unknown": {"type": "integer", "minimum": 0}, "error": {"type": "integer", "minimum": 0}, "not_applicable": {"type": "integer", "minimum": 0}}},
    "criterion": {"type": "object", "additionalProperties": false,
      "required": ["id", "requirement", "source_ref", "required", "applicability", "methods_allowed", "acceptance_rule", "expected_evidence", "provisional"],
      "properties": {"id": {"type": "string", "minLength": 1}, "requirement": {"type": "string", "minLength": 1}, "source_ref": {"type": "string"}, "required": {"type": "boolean"}, "applicability": {"type": "string"}, "methods_allowed": {"type": "array", "minItems": 1, "items": {"$ref": "#/$defs/method"}}, "acceptance_rule": {"type": "string", "minLength": 1}, "expected_evidence": {"type": "string"}, "provisional": {"type": "boolean"}}},
    "locator": {"type": "object", "oneOf": [
        {"additionalProperties": false, "required": ["file", "line_start", "line_end"], "properties": {"file": {"type": "string", "minLength": 1}, "line_start": {"type": "integer", "minimum": 1}, "line_end": {"type": "integer", "minimum": 1}}},
        {"additionalProperties": false, "required": ["command", "cwd", "exit_status", "log_ref"], "properties": {"command": {"type": "string", "minLength": 1}, "cwd": {"type": "string", "minLength": 1}, "exit_status": {"type": "integer"}, "log_ref": {"type": "string", "minLength": 1}}},
        {"additionalProperties": false, "required": ["passage", "source_ref", "source_date_or_version", "access_date"], "properties": {"passage": {"type": "string", "minLength": 1}, "source_ref": {"type": "string", "minLength": 1}, "source_date_or_version": {"type": "string", "minLength": 1}, "access_date": {"type": "string", "minLength": 1}}},
        {"additionalProperties": false, "required": ["note"], "properties": {"note": {"type": "string", "minLength": 1}}}]},
    "evidence": {"type": "object", "additionalProperties": false, "required": ["kind", "locator", "observation", "provenance", "isolation", "origin"],
      "properties": {"kind": {"enum": ["execution", "inspection", "supplied", "judgment"]}, "locator": {"$ref": "#/$defs/locator"}, "observation": {"type": "string", "minLength": 1},
                     "provenance": {"type": "object", "additionalProperties": false, "required": ["tool", "version", "revision", "timestamp"], "properties": {"tool": {"type": "string"}, "version": {"type": "string"}, "revision": {"type": "string"}, "timestamp": {"type": "string"}}},
                     "isolation": {"$ref": "#/$defs/isolation"}, "origin": {"enum": ["observed", "candidate_supplied", "retrieved"]}, "rubric_version": {"type": "string"}, "model": {"type": "string"}},
      "if": {"properties": {"kind": {"const": "judgment"}}}, "then": {"required": ["rubric_version"]}},
    "evidence_list": {"type": "array", "items": {"$ref": "#/$defs/evidence"}}
  }
}
