{
  "identity": {
    "report_id": "sha256:8133cd5af3691431144e38ab5e39c701833b2a53e6a08040139195d374b55465",
    "schema_version": "0.1.0",
    "veval_version": "0.0.0-dev",
    "skill_revision": "draft-2",
    "artifact": {
      "kind": "service_change",
      "revision": "git:9f2c1a4e5b6d7c8f9a0b1c2d3e4f5a6b7c8d9e0f",
      "paths": [
        "examples/extended/service.go",
        "examples/extended/service_test.go"
      ],
      "bundle_digest": "sha256:1f0a5c7f2b3d4e5f60718293a4b5c6d7e8f90a1b2c3d4e5f60718293a4b5c6d7"
    },
    "task": {
      "requested_outcome": "Enforce the vendor's published per-key rate limit in the request path, keep the regression suite passing, and ship a reproducible container image.",
      "intended_user": "release engineer deciding whether to deploy the change",
      "brief_ref": "examples/extended/brief.md#intent"
    },
    "created_at": "2026-09-14T00:03:00Z",
    "host": {
      "cli": "fixture",
      "model": "unknown",
      "os": "any",
      "arch": "any"
    }
  },
  "contract": {
    "contract_id": "extended-example",
    "contract_version": "1",
    "status": "provisional",
    "conflicts": [
      {
        "between": [
          "E1",
          "E4"
        ],
        "description": "The suite is run against the worktree toolchain while the image is built from a pinned one; the brief does not say which toolchain the release is accepted on.",
        "resolution": "unresolved"
      }
    ],
    "criteria": [
      {
        "id": "E1",
        "requirement": "The regression suite passes against this exact revision",
        "source_ref": "examples/extended/brief.md#acceptance-criteria",
        "required": true,
        "applicability": "always",
        "methods_allowed": [
          "execution"
        ],
        "acceptance_rule": "A regression suite runs against this revision in an isolated worktree and reports no failures.",
        "expected_evidence": "A command locator with cwd, exit status, and a log reference bound to the revision.",
        "provisional": false
      },
      {
        "id": "E2",
        "requirement": "The enforced rate limit matches the vendor's published limit",
        "source_ref": "examples/extended/brief.md#acceptance-criteria",
        "required": true,
        "applicability": "always",
        "methods_allowed": [
          "source_verification",
          "static_inspection"
        ],
        "acceptance_rule": "The limit the change enforces equals the limit stated by the vendor's published documentation at a named version.",
        "expected_evidence": "A passage locator naming the source and its date, and the line that enforces the limit.",
        "provisional": false
      },
      {
        "id": "E3",
        "requirement": "Throughput stays at or above the stated target",
        "source_ref": "examples/extended/brief.md#throughput",
        "required": false,
        "applicability": "when a benchmark workload is supplied",
        "methods_allowed": [
          "deterministic_check",
          "execution"
        ],
        "acceptance_rule": "Measured throughput on the stated workload is at or above 500 requests per second.",
        "expected_evidence": "A dimension entry with a measured value, its unit, and the tool that produced it.",
        "provisional": false
      },
      {
        "id": "E4",
        "requirement": "The container image builds reproducibly from the revision",
        "source_ref": "examples/extended/brief.md#acceptance-criteria",
        "required": true,
        "applicability": "always",
        "methods_allowed": [
          "execution"
        ],
        "acceptance_rule": "Two builds of this revision produce the same image digest.",
        "expected_evidence": "Command locators for both builds and the digests they printed.",
        "provisional": false
      },
      {
        "id": "E5",
        "requirement": "Vendored third-party sources carry their upstream license headers",
        "source_ref": "examples/extended/brief.md#acceptance-criteria",
        "required": true,
        "applicability": "when the revision vendors third-party sources",
        "methods_allowed": [
          "static_inspection"
        ],
        "acceptance_rule": "Every vendored file carries the upstream license header.",
        "expected_evidence": "Inspection of each vendored file's first lines.",
        "provisional": false
      },
      {
        "id": "E6",
        "requirement": "The artifact was not modified during evaluation",
        "source_ref": "examples/extended/brief.md#integrity",
        "required": true,
        "applicability": "always",
        "methods_allowed": [
          "static_inspection",
          "rubric_judgment"
        ],
        "acceptance_rule": "The artifact tree after evaluation matches the tree the evaluation started from.",
        "expected_evidence": "Pre- and post-evaluation tree digests, or a reasoned reading of what changed.",
        "provisional": false
      }
    ]
  },
  "routing": {
    "supplied": [
      {
        "source_type": "brief",
        "count": 1,
        "origin": "user"
      },
      {
        "source_type": "artifact",
        "count": 2,
        "origin": "candidate"
      },
      {
        "source_type": "candidate_claim",
        "count": 1,
        "origin": "candidate"
      }
    ],
    "profiles": [
      {
        "name": "requirements-and-tests",
        "version": "0.1"
      },
      {
        "name": "release-readiness",
        "version": "0.2"
      }
    ],
    "adapters_run": [
      {
        "name": "go-test",
        "version": "0.1",
        "inputs_used": [
          "examples/extended/service_test.go"
        ]
      },
      {
        "name": "mtime-drift",
        "version": "0.3",
        "inputs_used": [
          "examples/extended/service.go"
        ]
      }
    ],
    "adapters_skipped": [
      {
        "name": "container-build",
        "missing_input": "container toolchain on the evaluation host"
      }
    ],
    "ambiguity": [
      {
        "question": "Does the rate limit apply per API key or per client address?",
        "resolution": "Read as per API key: the brief and the vendor documentation both state the limit per key."
      }
    ],
    "rationale": "Service change with a supplied test suite and a cited external limit, so execution and source verification both ran; the container and benchmark adapters had no toolchain to run on."
  },
  "observations": [
    {
      "id": "O1",
      "text": "The request path enforces the limit per API key, matching the published documentation.",
      "evidence": [
        {
          "kind": "inspection",
          "locator": {
            "file": "examples/extended/service.go",
            "line_start": 48,
            "line_end": 52
          },
          "observation": "const rateLimitPerMinute = 100 // per API key",
          "provenance": {
            "tool": "assistant",
            "version": "fixture",
            "revision": "git:9f2c1a4e5b6d7c8f9a0b1c2d3e4f5a6b7c8d9e0f",
            "timestamp": "2026-09-14T00:04:00Z"
          },
          "isolation": "none",
          "origin": "observed"
        }
      ],
      "criterion_ids": [
        "E2"
      ],
      "origin": "assistant"
    },
    {
      "id": "O2",
      "text": "The evaluation host has no container toolchain, so the reproducibility and throughput checks could not run.",
      "evidence": [
        {
          "kind": "execution",
          "locator": {
            "command": "docker --version",
            "cwd": "/tmp/veval-worktree",
            "exit_status": 127,
            "log_ref": "logs/o2-docker-version.log"
          },
          "observation": "zsh: command not found: docker",
          "provenance": {
            "tool": "shell",
            "version": "zsh 5.9",
            "revision": "git:9f2c1a4e5b6d7c8f9a0b1c2d3e4f5a6b7c8d9e0f",
            "timestamp": "2026-09-14T00:06:00Z"
          },
          "isolation": "none",
          "origin": "observed"
        }
      ],
      "criterion_ids": [
        "E3",
        "E4"
      ],
      "origin": "adapter"
    }
  ],
  "claims": [
    {
      "claim_id": "CL1",
      "text": "The regression suite passes on this revision.",
      "location": "pull request description, paragraph 1",
      "status": "verified",
      "verification": [
        {
          "kind": "execution",
          "locator": {
            "command": "go test ./...",
            "cwd": "/tmp/veval-worktree",
            "exit_status": 0,
            "log_ref": "logs/e1-go-test.log"
          },
          "observation": "ok  github.com/example/service  1.204s; 42 tests, 0 failures",
          "provenance": {
            "tool": "go",
            "version": "1.23.1",
            "revision": "git:9f2c1a4e5b6d7c8f9a0b1c2d3e4f5a6b7c8d9e0f",
            "timestamp": "2026-09-14T00:03:12Z"
          },
          "isolation": "worktree",
          "origin": "observed"
        }
      ],
      "notes": "Re-run by the evaluator in a worktree checked out at this revision."
    },
    {
      "claim_id": "CL2",
      "text": "Throughput improved to 610 requests per second.",
      "location": "pull request description, paragraph 2",
      "status": "unverified",
      "verification": [],
      "notes": "No workload, tool, or log accompanies the number."
    }
  ],
  "criteria": [
    {
      "id": "E1",
      "result": "PASS",
      "method_used": "execution",
      "evidence": [
        {
          "kind": "execution",
          "locator": {
            "command": "go test ./...",
            "cwd": "/tmp/veval-worktree",
            "exit_status": 0,
            "log_ref": "logs/e1-go-test.log"
          },
          "observation": "ok  github.com/example/service  1.204s; 42 tests, 0 failures",
          "provenance": {
            "tool": "go",
            "version": "1.23.1",